date,title,original_link,subhead,author,source,pic_list,body
03/02/2020,"NÓNG: Truy tố nhóm giang hồ vây xe chở các ""sếp"" công an ở Đồng Nai",https://nld.com.vn/thoi-su/nong-truy-to-nhom-giang-ho-vay-xe-cho-cac-sep-cong-an-o-dong-nai-20200302142857258.htm,"##  (NLĐO) - Giang ""36"" cùng đồng bọn bị truy tố ra tòa về tội ""Gây rối trật
tự công cộng"", một số đối tượng tiếp tục bị điều tra làm rõ về các tội danh
khác.

","Xuân Hoàng

",,https://nld.mediacdn.vn/thumb_w/684/2020/3/2/644886621034030833469351225335106997321728n-1561352332733668387925-1570101290431644537117-15765778083541552218131-15831339102061856377145.jpg|NÓNG: Truy tố nhóm giang hồ vây xe chở các sếp công an ở Đồng Nai - Ảnh 1.&&https://nld.mediacdn.vn/thumb_w/684/2020/3/2/15-chot-156060887294521118235-1565682115018437897876-15831340128541057907701.jpg|NÓNG: Truy tố nhóm giang hồ vây xe chở các sếp công an ở Đồng Nai - Ảnh 2.,"Liên quan vụ băng giang hồ Giang ""36"" tổ chức bao vây các xe chở công an sau
xô xát tại cuộc nhậu trong nhà hàng trên đường Đặng Văn Trơn gây rúng động dư
luận, VKSND TP Biên Hòa, tỉnh Đồng Nai ngày 2-3 cho biết đã hoàn tất cáo
trạng, chuyển hồ sơ sang TAND cùng cấp truy tố nhóm đối tượng ra tòa chờ xét
xử.

Theo đó, các bị can Nguyễn Tấn Lương (38 tuổi), Ngô Đình Giang (còn gọi là
Giang ""36"", 34 tuổi), Nguyễn Duy Kỷ (còn gọi Tuấn ""nhóc"", 31 tuổi) và Mai Văn
Căn (còn gọi Tý, 30 tuổi, cùng ngụ TP Biên Hòa), Bùi Văn Thái bị truy tố ra
tòa về tội ""Gây rối trật tự công cộng"". Riêng Thái hiện đang bỏ trốn, công an
tiếp tục tuy bắt.

![NÓNG: Truy tố nhóm giang hồ vây xe chở các sếp công an ở Đồng Nai - Ảnh
1.](https://nld.mediacdn.vn/thumb_w/684/2020/3/2/644886621034030833469351225335106997321728n-1561352332733668387925-1570101290431644537117-15765778083541552218131-15831339102061856377145.jpg)

Giang ""36"" thời điểm xảy ra vụ việc

Theo cáo trạng, khoảng 13 giờ ngày 12-6-2019, nhóm gồm Nguyễn Tấn Lương, Lê Võ
Trường Hải (ngụ Đắk Lắk) cùng 8 người khác ăn uống tại phòng VIP 8 của nhà
hàng Lam Viên (phường Hiệp Hòa, TP Biên Hòa). Nhóm khác gồm Phạm Văn Hiền (ngụ
huyện Định Quán), trung tá Nguyễn Quang Trường, trung tá Đinh Tú Anh và đại tá
Huỳnh Bảo Hùng (nguyên trưởng Phòng Cảnh sát PCCC) ngồi tại phòng VIP 2.

Tại đây, trong khi Lương ra phía hành lang để nói chuyện điện thoại thì Hiền
thuộc nhóm đối phương từ phòng VIP 2 đi ra ngoài khi qua chỗ Lương đã vô tình
nôn ói không kiểm soát, văng vào quần của Lương.

Lúc này, Lương đã dùng tay đánh một cái vào mặt Hiền nhưng không gây thương
tích. Hải thấy sự việc đã can ngăn và đưa Lương trở lại bàn ăn. Hiền kể lại sự
việc nôn ói cho mọi người nghe rồi cùng Trường và Tú Anh qua phòng đối phương
với ý định xin lỗi, nhưng khi vừa vào phòng thì hai bên lại lời qua tiếng lại
dẫn đến xô xát.

Trong lúc ẩu đả, ném nhau bằng chén, đĩa, anh Hải bị thương tích 7%.

![NÓNG: Truy tố nhóm giang hồ vây xe chở các sếp công an ở Đồng Nai - Ảnh
2.](https://nld.mediacdn.vn/thumb_w/684/2020/3/2/15-chot-156060887294521118235-1565682115018437897876-15831340128541057907701.jpg)

Băng xăm trổ manh động vây kín cả đoạn đường thời điểm xảy ra vụ việc

Vụ việc xảy ra, lúc này Lương đã điện thoại cho Giang ""36"". Giang liền gọi
điện thoại cho Tuấn ""nhóc"", Bùi Văn Thái (còn gọi là Thái ""đen"") cùng đến tại
nhà hàng. Khi nhóm Hiền rời phòng VIP 8 rồi lên xe 4 chỗ của Tú Anh ra về thì
bị Lương cùng một số đối tượng xăm trổ chặn xe, buộc dừng lại giải quyết.
Giang ""36"" và nhóm xăm trổ đồng thời la hét, lớn tiếng hăm dọa gây náo loạn
khu vực đường Đặng Văn Trơn nhiều giờ liền.

Nhiều tình tiết, nội dung liên quan vụ việc vẫn đang tiếp tục được làm rõ.

Xuân Hoàng

[

Chia sẻ

](javascript:;)

[ ![](https://nld.mediacdn.vn/web_images/icon-print-3.png)
](/Print.aspx?NewsID=20200302142857258 ""Print"")

"
23/03/2020,Người Quảng Nam đổi rác thải lấy đồ chống dịch Covid-19,https://nld.com.vn/ban-doc/nguoi-quang-nam-doi-rac-thai-lay-do-chong-dich-covid-19-20200323093618332.htm,"##  (NLĐO) – Chỉ cần có rác thải nhựa là có thể đổi để lấy các sản phẩm chống
dịch Covid-19, số rác thải nhựa này sẽ tiếp tục được bán lấy tiền mua nguyên
liệu may khẩu trang phát miễn phí cho người dân.

","Tr.Thường

",,https://nld.mediacdn.vn/thumb_w/684/2020/3/23/dsc0440-1584930652739777719577-crop-15849307101151576634079.jpg|Người Quảng Nam đổi rác thải lấy đồ chống dịch Covid-19 - Ảnh 1.,"Ngày 23-3, Ban chỉ đạo Phòng, chống dịch Covid-19 tỉnh Quảng Nam, cho biết
phong trào ""Đổi rác thải nhựa lấy sản phẩm phòng chống dịch Covid-19"" đang dần
lan tỏa tại một số địa phương trên địa bàn tỉnh Quảng Nam.  

Đây là phong trào được phát động bởi Đoàn Thanh niên huyện Núi Thành (tỉnh
Quảng Nam). Theo đó, người dân địa phương chỉ cần mang các loại rác thải như
vỏ chai nhựa, lon bia, giấy vụn đến các điểm quy định có thể đổi lấy dung dịch
sát khuẩn khô, nước rửa tay, xà phòng sát khuẩn... để phòng chống dịch
Covid-19.

![Người Quảng Nam đổi rác thải lấy đồ chống dịch Covid-19 - Ảnh
1.](https://nld.mediacdn.vn/thumb_w/684/2020/3/23/dsc0440-1584930652739777719577-crop-15849307101151576634079.jpg)

Người dân huyện Núi Thành mang rác thải nhựa đổi lấy sản phẩm chống dịch
Covid-19 Ảnh: HỒNG CƯỜNG

Số rác thải nhựa mà người dân mang đến sẽ được Huyện đoàn Núi Thành tiếp tục
bán lấy kinh phí mua nguyên liệu may khẩu trang phát miễn phí cho người dân.

Sau khi phát động, chương trình đã được người dân huyện Núi Thành hưởng ứng
tích cực. Nhiều người đánh giá cao hoạt động này vì không chỉ giúp người dân
có các sản phẩm để phòng chống dịch hiệu quả mà còn có thể bảo vệ môi trường
sống của mình.

Liên quan đến tình hình dịch Covid-19 , tính đến ngày 22-3, ngành y tế tỉnh
Quảng Nam đã thực hiện 387 mẫu xét nghiệm. Trong đó, ba mẫu dương tính (bệnh
nhân 31, 33 và 57 là 3 du khách người Anh), 342 mẫu âm tính, 42 mẫu đang chờ
kết quả.

Tr.Thường

[

Chia sẻ

](javascript:;)

[ ![](https://nld.mediacdn.vn/web_images/icon-print-3.png)
](/Print.aspx?NewsID=20200323093618332 ""Print"")

"
31/03/2020,Trường ĐH Hoa Sen bổ nhiệm hiệu trưởng mới,https://nld.com.vn/giao-duc-khoa-hoc/truong-dh-hoa-sen-bo-nhiem-hieu-truong-moi-20200331133616298.htm,"##  (NLĐO)- PGS- TS Nguyễn Ngọc Điện, nguyên Phó Hiệu trưởng Trường ĐH Kinh
tế- Luật được bổ nhiệm làm hiệu trưởng Trường ĐH Hoa Sen.

","Huy Lân

",,https://nld.mediacdn.vn/thumb_w/684/2020/3/31/screen-shot-2020-03-31-at-133203-15856363705941473484350.png|Trường ĐH Hoa Sen bổ nhiệm hiệu trưởng mới - Ảnh 1.,"![Trường ĐH Hoa Sen bổ nhiệm hiệu trưởng mới - Ảnh
1.](https://nld.mediacdn.vn/thumb_w/684/2020/3/31/screen-
shot-2020-03-31-at-133203-15856363705941473484350.png)

PGS-TS Thái Bá Cần (trái) trao Quyết định bổ nhiệm PGS-TS Nguyễn Ngọc Điện làm
hiệu trưởng [Trường ĐH Hoa Sen](https://nld.com.vn/truong-dh-hoa-sen.html
""Trường ĐH Hoa Sen"")

Sáng ngày 31-3, tại Trường ĐH Hoa Sen, PGS- TS Thái Bá Cần, Chủ tịch Hội đồng
trường đã công bố quyết định bổ nhiệm PGS-TS Nguyễn Ngọc Điện làm hiệu trưởng
trường này.

Tại buổi công bố này, PGS-TS Thái Bá Cần, cho biết sau hơn một năm về công tác
tại trường và giữ chức vụ Hiệu trưởng Trường ĐH Hoa Sen (HSU), nay vì lý do cá
nhân GS-TS Mai Hồng Quỳ thôi làm hiệu trưởng.

Để điều hành nhà trường trong thời gian tới, Hội đồng Trường đã mời PGS-TS
Nguyễn Ngọc Điện đảm nhận chức vụ Hiệu trưởng Trường ĐH Hoa Sen nhiệm kỳ
2017-2022.

Chia sẻ về quyết định của mình trên cương vị mới, PGS-TS Nguyễn Ngọc Điện cho
biết qua những lần trao đổi suy nghĩ về tương lai của đại học tư nói chung và
HSU nói riêng, ông tìm được tiếng nói chung trong việc đề ra giải pháp cho bài
toán phát triển HSU trong dài hạn. Chính kết quả tích cực của những cuộc đối
thoại đó, cùng với sự ủng hộ của GS-TS Mai Hồng Quỳ, người tiền nhiệm đã trở
thành cơ duyên để ông bắt đầu hành trình mới tại HSU.

Ông cho biết HSU sẽ tiếp tục khai thác các thế mạnh vốn trong các lĩnh vực đào
tạo như kinh tế - quản lý, ngôn ngữ, du lịch – khách sạn, nghệ thuật... và mở
thêm ngành luật.

""Tôi có một hoài bão, gọi là tham vọng cũng được, là làm cho HSU được biết,
được thừa nhận là đại học quốc tế không chỉ dành cho người Việt, mà cho tất cả
mọi người đến từ tất cả các nơi trên thế giới. Hơn nữa, HSU phải được thừa
nhận là một địa chỉ đào tạo có uy tín, danh giá, được người học, phụ huynh
nhắc đến với niềm tự hào"", PGS-TS Nguyễn Ngọc Điện chia sẻ.

PGS-TS Nguyễn Ngọc Điện sinh năm 1959, là tiến sĩ Luật. Ông là nguyên Phó Hiệu
trưởng Trường Đại học Kinh tế - Luật (ĐHQG TP HCM):

Huy Lân

[

Chia sẻ

](javascript:;)

[ ![](https://nld.mediacdn.vn/web_images/icon-print-3.png)
](/Print.aspx?NewsID=20200331133616298 ""Print"")

"
03/12/2020,VIDEO: Vỉa hè tại TP HCM đang bị tái chiếm đến mức khó tin,https://nld.com.vn/thoi-su/video-via-he-tai-tp-hcm-dang-bi-tai-chiem-den-muc-kho-tin-20200312124022292.htm,"##  (NLĐO) - Dù giảm do ảnh hưởng bởi dịch Covid-19, lượng khách vắng nhiều
hàng quán đóng cửa, thế nhưng không ít khu vực tại TP HCM, vỉa hè vẫn bị lấn
chiếm tràn lan!

","Bài- ảnh- video: Hạ Giang - Gia Minh

",,https://nld.mediacdn.vn/thumb_w/684/2020/3/12/01-1583989824936647317945.jpg|VIDEO: Vỉa hè tại TP HCM đang bị tái chiếm đến mức khó tin - Ảnh 2.&&https://nld.mediacdn.vn/thumb_w/684/2020/3/12/z7-15839896440101830803705.jpg|VIDEO: Vỉa hè tại TP HCM đang bị tái chiếm đến mức khó tin - Ảnh 3.&&https://nld.mediacdn.vn/thumb_w/684/2020/3/12/z2-15839896440031376360799.jpg|VIDEO: Vỉa hè tại TP HCM đang bị tái chiếm đến mức khó tin - Ảnh 4.&&https://nld.mediacdn.vn/thumb_w/684/2020/3/12/z15-15839896938571422259485.jpg|VIDEO: Vỉa hè tại TP HCM đang bị tái chiếm đến mức khó tin - Ảnh 5.&&https://nld.mediacdn.vn/thumb_w/684/2020/3/12/z5-15839896157191637985989.jpg|VIDEO: Vỉa hè tại TP HCM đang bị tái chiếm đến mức khó tin - Ảnh 6.&&https://nld.mediacdn.vn/thumb_w/684/2020/3/12/z10-15839897201761774824921.jpg|VIDEO: Vỉa hè tại TP HCM đang bị tái chiếm đến mức khó tin - Ảnh 7.&&https://nld.mediacdn.vn/thumb_w/684/2020/3/12/z11-15839900327902146783988.jpg|VIDEO: Vỉa hè tại TP HCM đang bị tái chiếm đến mức khó tin - Ảnh 8.&&https://nld.mediacdn.vn/thumb_w/684/2020/3/12/z6-15839896157231724233637.jpg|VIDEO: Vỉa hè tại TP HCM đang bị tái chiếm đến mức khó tin - Ảnh 9.&&https://nld.mediacdn.vn/thumb_w/684/2020/3/12/z16-158399020573936176772.jpg|VIDEO: Vỉa hè tại TP HCM đang bị tái chiếm đến mức khó tin - Ảnh 10.&&https://nld.mediacdn.vn/thumb_w/684/2020/3/12/z9-1583990327153773175552.jpg|VIDEO: Vỉa hè tại TP HCM đang bị tái chiếm đến mức khó tin - Ảnh 11.&&https://nld.mediacdn.vn/thumb_w/684/2020/3/12/317fc4c8999e62c03b8f-15839904564331632578576.jpg|VIDEO: Vỉa hè tại TP HCM đang bị tái chiếm đến mức khó tin - Ảnh 12.&&https://nld.mediacdn.vn/thumb_w/684/2020/3/12/a12cb6abeefd15a34cec-15839908852681170844846.jpg|VIDEO: Vỉa hè tại TP HCM đang bị tái chiếm đến mức khó tin - Ảnh 13.,"Ghi nhận thực tế trên nhiều tuyến đường tại TP HCM, ảnh hưởng từ dịch Covid-19
và sau khi có quy định mới tăng mức phạt đối với người lái xe có sử dụng rượu
bia, lượng khách giảm mạnh. Nhiều khu vực tập trung các nhà hàng, quán ăn,
nhất là nơi có nhiều quán nhậu, theo đó đóng cửa hoặc trả mặt bằng. Đó là một
trong những nguyên nhân khiến việc buôn bán lấn chiếm vỉa hè tại TP giảm khá
nhiều, tuy nhiên tại nhiều khu vực, quán vắng khách cửa cứ đóng, quán đông
khách vẫn thi nhau chiếm dụng lòng đường, vỉa hè.  

VIDEO: Vỉa hè tại TP HCM bị tái chiếm - nội dung ghi nhận vào đêm 11-3

Sau 2 bài viết nêu tình trạng lấn chiếm vỉa hè, lòng đường, đăng trên Báo
Người Lao Động số ra các ngày 9 và 10-3, chúng tôi có mặt ghi nhận tại nhiều
địa điểm đã phản ánh nhưng tình trạng trên vẫn không thuyên giảm bao nhiêu.

Đường Phạm Văn Đồng, đoạn kéo dài từ giao lộ Nguyễn Xí đến vòng xoay Nguyễn
Kiệm - Nguyễn Thái Sơn (thuộc địa bàn quận Bình Thạnh và Gò Vấp), dù các quán
nhậu giảm so với trước nhưng nhiều đoạn, vỉa hè vẫn bị lấn chiếm ""không thương
tiếc"".

![VIDEO: Vỉa hè tại TP HCM đang bị tái chiếm đến mức khó tin - Ảnh
2.](https://nld.mediacdn.vn/thumb_w/684/2020/3/12/01-1583989824936647317945.jpg)

Tại đoạn gần giao lộ với đường Nguyễn Xí (quận Bình Thạnh), trên đường Phạm
Văn Đồng, quán nhậu chiếm dụng hoàn toàn một đoạn dài vỉa hè bày biện bàn ghế
và làm nơi giữ xe cho khách ăn uống. Dưới lòng đường, nhân viên quán lố nhố
đứng vẫy tay mời chào khách vào quán.

![VIDEO: Vỉa hè tại TP HCM đang bị tái chiếm đến mức khó tin - Ảnh
3.](https://nld.mediacdn.vn/thumb_w/684/2020/3/12/z7-15839896440101830803705.jpg)

Cách đó không xa là là đủ loại hàng bán mũ bảo hiểm, quán nước..., bày chật
kín trên vỉa hè.

![VIDEO: Vỉa hè tại TP HCM đang bị tái chiếm đến mức khó tin - Ảnh
4.](https://nld.mediacdn.vn/thumb_w/684/2020/3/12/z2-15839896440031376360799.jpg)

Tương tự, đường Phạm Văn Đồng gần đoạn giao với đường ngang xe lửa (quận Gò
Vấp), hàng loạt quán nhậu, bán trái cây, nước uống..., cũng lấn chiếm tràn lan
trên vỉa hè.

![VIDEO: Vỉa hè tại TP HCM đang bị tái chiếm đến mức khó tin - Ảnh
5.](https://nld.mediacdn.vn/thumb_w/684/2020/3/12/z15-15839896938571422259485.jpg)

Nhiều quán khá vắng khách, nhưng bàn ghế vẫn xếp la liệt trên vỉa hè, khói nấu
ăn nghi ngút chờ khách.

![VIDEO: Vỉa hè tại TP HCM đang bị tái chiếm đến mức khó tin - Ảnh
6.](https://nld.mediacdn.vn/thumb_w/684/2020/3/12/z5-15839896157191637985989.jpg)

Đường Nguyễn Gia Trí (D2 cũ), Điện Biên Phủ, đoạn qua ngã tư Hàng Xanh (quận
Bình Thạnh), vỉa hè cũng bị chiếm dụng không thương tiếc.

![VIDEO: Vỉa hè tại TP HCM đang bị tái chiếm đến mức khó tin - Ảnh
7.](https://nld.mediacdn.vn/thumb_w/684/2020/3/12/z10-15839897201761774824921.jpg)

Tại khu nội thành, trên hàng loạt tuyến đường, đủ loại hàng quán cơi nới mái
hiên, che bạt, dựng bảng hiệu, kê bàn ghế, đậu xe kín mít trên vỉa hè. Đơn cử
như trên đường Trường Sa, Hoàng Sa (qua địa bàn các quận 1, 3, Bình Thạnh, Phú
Nhuận và Tân Bình), hàng loạt quán nhậu đua nhau lấn chiếm về đêm.

![VIDEO: Vỉa hè tại TP HCM đang bị tái chiếm đến mức khó tin - Ảnh
8.](https://nld.mediacdn.vn/thumb_w/684/2020/3/12/z11-15839900327902146783988.jpg)

Tại khu vực gần cầu Công Lý (quận Phú Nhuận), các quán nhậu xếp kín bàn ghế,
xe cộ trên vỉa hè. Người đi bộ phải luồn lách giữa các hàng ghế hoặc di chuyển
dưới lòng đường.

![VIDEO: Vỉa hè tại TP HCM đang bị tái chiếm đến mức khó tin - Ảnh
9.](https://nld.mediacdn.vn/thumb_w/684/2020/3/12/z6-15839896157231724233637.jpg)

Tại giao lộ Trường Sa - Nguyễn Công Hoan vào ban ngày, các quán cà phê xếp xe
của khách kín vỉa hè và tràn xuống lòng đường

![VIDEO: Vỉa hè tại TP HCM đang bị tái chiếm đến mức khó tin - Ảnh
10.](https://nld.mediacdn.vn/thumb_w/684/2020/3/12/z16-158399020573936176772.jpg)

Không ngoại lệ, đường Võ Văn Tần (quận 3) nhiều đoạn vỉa hè cũng bị nhường chỗ
cho các quán nhậu, nơi giữ xe. Đơn cử như khu vực gần giao lộ với đường Bà
Huyện Thanh Quan, Trương Định, quán nhậu lấn chiếm, mở cửa tới khuya cho khách
ăn uống.

![VIDEO: Vỉa hè tại TP HCM đang bị tái chiếm đến mức khó tin - Ảnh
11.](https://nld.mediacdn.vn/thumb_w/684/2020/3/12/z9-1583990327153773175552.jpg)

Tình trạng tương tự cũng diễn ra ở nhiều tuyến đường khác như Ngô Gia Tự, Lê
Hồng Phong (quận 10); Tây Thạnh (quận Tân Phú)... Trong hình là đường Ngô Gia
Tự (quận 10)

![VIDEO: Vỉa hè tại TP HCM đang bị tái chiếm đến mức khó tin - Ảnh
12.](https://nld.mediacdn.vn/thumb_w/684/2020/3/12/317fc4c8999e62c03b8f-15839904564331632578576.jpg)

![VIDEO: Vỉa hè tại TP HCM đang bị tái chiếm đến mức khó tin - Ảnh
13.](https://nld.mediacdn.vn/thumb_w/684/2020/3/12/a12cb6abeefd15a34cec-15839908852681170844846.jpg)

Đặc biệt, tình trạng lấn chiếm vỉa hè, lòng đường còn trầm trọng hơn ở trước
nhiều bệnh viện, khu chợ..., gây lộn xộn và mất an toàn giao thông. Đơn cử như
khu vực trước Bệnh viện Ung Bướu, chợ Bà Chiểu...

Số liệu đánh giá từ Trung tâm Quản lý hạ tầng giao thông đường bộ ở 198 tuyến
đường tại TP HCM cho biết năm 2019 có 49 tuyến thông thoáng (chiếm 24,75%),
120 tuyến có chuyển biến (chiếm 60,61%) và 29 tuyến bị đánh giá còn phức tạp
(14,65%). Các địa phương bị đánh giá có nhiều hạn chế trong công tác này và
cần tăng cường chấn chỉnh gồm các quận 5, 8, Gò Vấp và huyện Bình Chánh.

Theo Ban An toàn giao thông TP, việc lập lại trật tự lòng đường, vỉa hè tại TP
năm 2019 đạt được một số kết quả tích cực, nhiều địa phương đã đưa ra các mô
hình, sáng kiến để quản lý lòng đường, vỉa hè tốt hơn. Tuy nhiên, thực tế vẫn
tồn tại nhiều hạn chế, do đó năm 2020, Ban An toàn giao thông đang kiến nghị
UBND TP sớm ban hành quy định về quản lý, sử dụng lòng đường, vỉa hè trên địa
bàn. Đồng thời, các quận, huyện cần xây dựng đề án quản lý, sử dụng lòng lề
đường và đề ra mục tiêu, lộ trình, giải pháp thực hiện đối với từng tuyến
đường, địa bàn, khu vực cụ thể... Đặc biệt, đẩy mạnh ứng dụng công nghệ thông
tin trong giám sát, quản lý.

Bài- ảnh- video: Hạ Giang - Gia Minh

[

Chia sẻ

](javascript:;)

[ ![](https://nld.mediacdn.vn/web_images/icon-print-3.png)
](/Print.aspx?NewsID=20200312124022292 ""Print"")

"
