date,title,original_link,subhead,author,source,pic_list,body
25/06/2020,70% trẻ bị lác có kèm theo các tật khúc xạ,https://nld.com.vn/suc-khoe/70-tre-bi-lac-co-kem-theo-cac-tat-khuc-xa-20200624181515294.htm,"##  Tại buổi hội thảo ""Nâng cao nhận thức chăm sóc và bảo vệ mắt cho trẻ em"",
do Bệnh viện Mắt Hà Nội 2 tổ chức mới đây, TS-BS Vũ Anh Tuấn, giảng viên
Trường ĐH Y Hà Nội, cho biết tại Việt Nam có khoảng 3 triệu trẻ em đang mắc
tật khúc xạ cần được chỉnh kính, trong đó tỉ lệ trẻ em mắc khúc xạ ở các TP
lớn lên tới 60% - 70%.

","Tin-ảnh: D.Thu

",,https://nld.mediacdn.vn/thumb_w/684/2020/6/24/tin-c-1592996779867711704375.jpg|70% trẻ bị lác có kèm theo các tật khúc xạ - Ảnh 1.,"Theo BS Tuấn, cận thị thường xảy ra ở những đối tượng trẻ như học sinh, sinh
viên… nhưng lại không được quan tâm đúng mức. Trẻ bị cận thị có những biểu
hiện ban đầu như đi học khi nhìn thường có dấu hiệu hay mỏi mắt, đau đầu, sợ
ánh sáng, nhìn cự ly xa không rõ... Độ tuổi học sinh là giai đoạn độ cận tiến
triển nhanh, có thể dẫn tới các biến chứng gây mù lòa. ""Cận thị ở trẻ em đang
ngày một nhiều, đặc biệt là ở các TP lớn. Thực tế cho thấy, trẻ em sinh ra có
dị tật về mắt như cận thị chỉ chiếm tỉ lệ 10%, còn tới 90% trẻ bị cận thị là
do các nguyên nhân khác gây ra như nhìn gần, nhìn không đủ ánh sáng hay sinh
hoạt không khoa học"" - BS Tuấn nói.

![70% trẻ bị lác có kèm theo các tật khúc xạ - Ảnh
1.](https://nld.mediacdn.vn/thumb_w/684/2020/6/24/tin-c-1592996779867711704375.jpg)

Trẻ em cần được khám sàng lọc mắt mỗi năm ít nhất một lần

Bên cạnh đó, có tới 70% trẻ bị lác có kèm theo các tật khúc xạ do không được
chỉnh kính. Nhiều nghiên cứu về tình trạng mắt trẻ em, đặc biệt là trẻ sơ sinh
ở Việt Nam, đã chỉ ra hiện có khoảng 2 - 3 triệu trẻ bị lác, chiếm khoảng 2% -
4% tổng dân số của nước ta. Đáng nói là hiện tượng bị lác ở trẻ em ngày càng
tăng và nhiều trẻ không được khám, chữa kịp thời đã gây ảnh hưởng nặng nề tới
thẩm mỹ và cả thị lực.

PGS-TS-BS Nguyễn Đức Anh, Trưởng Khoa Khúc xạ Bệnh viện Mắt Hà Nội 2, khuyến
cáo cha mẹ khi thấy trẻ có các dấu hiệu lác mắt, sụp mi, xem tivi gần, nháy
mắt liên tục, nhức, mỏi mắt, khó nhìn xa hoặc nheo mắt khi nhìn xa thì nên đưa
đi thăm khám tại cơ sở y tế chuyên khoa mắt. Ngoài ra, cha mẹ cần tập thói
quen đưa trẻ đi khám sàng lọc mắt mỗi năm ít nhất một lần, với trẻ bị tật khúc
xạ là 2 lần. Lần thăm khám đầu tiên nên được tiến hành sớm, ngay khi trẻ 3 - 4
tuổi, tức là độ tuổi đã có thể hợp tác trong quá trình khám.

Tin-ảnh: D.Thu

[

Chia sẻ

](javascript:;)

[ ![](https://nld.mediacdn.vn/web_images/icon-print-3.png)
](/Print.aspx?NewsID=20200624181515294 ""Print"")

"
24/06/2020,Sao phim người lớn bị buộc tội cưỡng hiếp 3 phụ nữ,https://nld.com.vn/giai-tri/sao-phim-nguoi-lon-bi-buoc-toi-cuong-hiep-3-phu-nu-20200624115600981.htm,"##  (NLĐO) – Nam diễn viên Ron Jeremy, ngôi sao dòng phim người lớn, bị buộc
tội cưỡng hiếp 3 phụ nữ, tấn công tình dục nhiều phụ nữ khác.

","M.Khuê (Theo Reuters)

",,https://nld.mediacdn.vn/thumb_w/684/2020/6/24/tai-xuong-1592974426058848491050.jpg|Sao phim người lớn bị buộc tội cưỡng hiếp 3 phụ nữ - Ảnh 1.&&https://nld.mediacdn.vn/thumb_w/684/2020/6/24/7b594637-7bb8-489a-9361-5909e956a2ca-aplapremiereofunity-1592974426056978232586.jpg|Sao phim người lớn bị buộc tội cưỡng hiếp 3 phụ nữ - Ảnh 2.,"Văn phòng luật sư hạt Los Angeles - Mỹ ngày 23-6, cho biết Ron Jeremy bị cáo
buộc cưỡng hiếp một phụ nữ 25 tuổi tại nhà riêng ở West Hollywood năm 2014.
Sau đó, ông này tiếp tục hành vi tấn công tình dục với 2 phụ nữ 33 và 46 tuổi
tại quán bar và cưỡng hiếp một trong số họ.

![Sao phim người lớn bị buộc tội cưỡng hiếp 3 phụ nữ - Ảnh
1.](https://nld.mediacdn.vn/thumb_w/684/2020/6/24/tai-
xuong-1592974426058848491050.jpg)

Ron Jeremy tại phiên tòa đầu tiên

Tháng 7-2019, ông bị tố cưỡng hiếp một phụ nữ 30 tuổi cũng tại quán bar đã
từng phạm tội với hai phụ nữ trước đó. Phía công tố cho biết nam diễn viên này
đối mặt với 3 tội cưỡng bức, 3 tội cưỡng bức xâm nhập, 1 tội cưỡng bức bằng
miệng, 1 tội bạo hành tình dục.

Trong phiên điều trần đầu tiên, Ron Jeremy bị tạm giam với mức tiền bảo lãnh
tại ngoại là 6,6 triệu USD. Phiên tòa tiếp theo xử diễn viên này dự kiến ngày
26-6. Nếu bị phán có tội, Ron Jeremy đối diện với án tù giam tối đa là 90 năm.

Người quản lý của Ron Jeremy là Dante Rusciolelli cho biết quyết định từ bỏ
quyền quản lý ngôi sao này sau khi nghe các tội danh. ""Chúng tôi hy vọng tất
cả các cáo buộc chống lại ông ấy không phải sự thật nhưng nếu chúng là sự thật
thì chúng tôi mong ông ấy sẽ chịu trách nhiệm trước pháp luật"" - Dante
Rusciolelli viết trên trang cá nhân.

Ron Jeremy, 67 tuổi, tên thật Ronald Jeremy Hyatt, là một trong những cái tên
lớn trong ngành công nghiệp phim khiêu dâm, phim người lớn. Ông đã xuất hiện
trong hơn 2.000 phim.

![Sao phim người lớn bị buộc tội cưỡng hiếp 3 phụ nữ - Ảnh
2.](https://nld.mediacdn.vn/thumb_w/684/2020/6/24/7b594637-7bb8-489a-9361-5909e956a2ca-
aplapremiereofunity-1592974426056978232586.jpg)

Ông tham gia trên 2.000 phim người lớn

Năm 2017, khi tờ Rolling Stone viết về các cáo buộc hành vi tình dục sai trái
của Ron Jeremy, ông đã lên tiếng phủ nhận tất cả. Diễn viên này khẳng định:
""Tôi chưa từng và sẽ không bao giờ cưỡng hiếp bất kỳ ai. Tất cả các cáo buộc
nghiêm trọng đều đã được cảnh sát điều tra và thẩm phán bác bỏ. Tôi chưa từng
bị buộc tội hay phải ngồi tù ngày nào vì những vụ này"".

M.Khuê (Theo Reuters)

[

Chia sẻ

](javascript:;)

[ ![](https://nld.mediacdn.vn/web_images/icon-print-3.png)
](/Print.aspx?NewsID=20200624115600981 ""Print"")

"
06/06/2020,"Sau cách ly, Ngọc Trinh gom tiền đầu tư YouTube",https://nld.com.vn/van-nghe/sau-cach-ly-ngoc-trinh-gom-tien-dau-tu-youtube-20200606091334896.htm,"##  (NLĐO) - Nếu ""ông bầu"" Khắc Tiệp trở thành Youtuber du lịch sang chảnh thì
""cô em"" Ngọc Trinh không kém khi theo đuổi ""trường phái"" Youtuber ""đập hộp""
hàng hiệu tiền tỉ.

","Thùy Trang

",,"https://nld.mediacdn.vn/thumb_w/684/2020/6/6/ngoc-trinh-dien-bikini-khoe-body-deo-tui-xach-hon-2-ty-dao-pho-bali-ac4a9479-1591409300734852889271.jpg|Sau cách ly, Ngọc Trinh gom tiền đầu tư YouTube - Ảnh 1.&&https://nld.mediacdn.vn/thumb_w/684/2020/6/6/ngoc-trinh-7-1591409300747675757349.png|Sau cách ly, Ngọc Trinh gom tiền đầu tư YouTube - Ảnh 2.&&https://nld.mediacdn.vn/thumb_w/684/2020/6/6/ngoc-trinh-8-15914093007451431130311-1591412689715175284661.png|Sau cách ly, Ngọc Trinh gom tiền đầu tư YouTube - Ảnh 3.","Đó có lẽ là lý do cả Vũ Khắc Tiệp và Ngọc Trinh đều luôn luôn cần rất nhiều
tiền để ""chăm sóc"" cho kênh YouTube của mình. Cách đây ít giờ, trên trang cá
nhân, Ngọc Trinh bất ngờ rao bán bất động sản. Theo những gì ""nữ hoàng nội y""
tiết lộ, cô muốn bán căn biệt thự của mình để gom tiền đầu tư phát triển kênh
Youtube.  

Không tiết lộ giá cụ thể, nhưng với những gì được miêu tả về diện tích cũng
như vị thế đắc địa của căn nhà, cư dân mạng đồn đoán căn nhà cũng tầm vài chục
tỉ đồng. Bởi ngay chính quà mà Ngọc Trinh hứa tặng cho người mua nhà là bản vẽ
đã có trị giá 300 triệu cho ai muốn sửa chữa, thay đổi biệt thự.

Đúng như lời của Ngọc Trinh, cô muốn gom tiền để làm kênh YouTube. Điều này
cũng chẳng lạ gì vì Ngọc Trinh nổi tiếng với việc chịu đầu tư cho kênh YouTube
của mình. Dù cô sở hữu kênh YouTube nhiều người xem nhưng chắc chắn, số tiền
đầu tư cho nội dung kênh của Ngọc Trinh sẽ lớn hơn rất nhiều so với doanh thu
của kênh. Tất nhiên, mức đầu tư này hoàn toàn không lệ thuộc vào nội dung của
kênh bởi Ngọc Trinh phát triển kênh YouTube của mình khá đơn giản: chủ yếu
""đập hộp"" hàng hiệu đắt đỏ và xa xỉ bậc nhất.

![Sau cách ly, Ngọc Trinh gom tiền đầu tư YouTube - Ảnh
1.](https://nld.mediacdn.vn/thumb_w/684/2020/6/6/ngoc-trinh-dien-bikini-khoe-
body-deo-tui-xach-hon-2-ty-dao-pho-bali-ac4a9479-1591409300734852889271.jpg)

Cô gom tiền để làm kênh Youtube

Cô thường xuyên sắm những món hàng hiệu đắt tiền, đem về và khui hộp để người
xem trầm trồ và hết. Dù không có nhiều nội dung và kênh cũng khá vô thưởng vô
phạt nhưng cô cũng thu hút nhiều người xem bởi khơi gợi khao khát một cuộc
sống tràn ngập tiền và sang chảnh như các siêu sao thế giới.

Không ít lần, chân dài Trà Vinh gây sốc khi liên tục thực hiện những clip đập
hộp các thương hiệu thời trang cao cấp trên thế giới, như Versace, Dior,
Chanel, Hermes, Christian Laboutin, Louis Vuitton, Prada, Stalvey, Casadei...

Cô không ngại chi tiền tỉ để có được những món đồ yêu thích và khoe với người
hâm mộ. Đó là lý do kênh YouTube của Ngọc Trinh khá thành công hiện nay. Thậm
chí, nhiều người đẹp của showbiz khác cũng sao y nội dung kênh YouTube của
Ngọc Trinh để tăng lượng tương tác với người xem.

![Sau cách ly, Ngọc Trinh gom tiền đầu tư YouTube - Ảnh
2.](https://nld.mediacdn.vn/thumb_w/684/2020/6/6/ngoc-
trinh-7-1591409300747675757349.png)

Điều này cũng dễ hiểu khi người đẹp thường xuyên làm những clip đập hộp đắt đỏ

Ngay khi đăng tải thông tin gom tiền làm YouTube, nhiều người mong Ngọc Trinh
sớm tái xuất bằng những clip đập hộp đồ hiệu xịn xò, dù chưa biết dự án mới
của Ngọc Trinh có phải đập hộp hay chuyển hướng sang nội dung mới lạ hơn.

""Bán nhà để làm kênh Youtube chắc showbiz có mỗi Ngọc Trinh. Chịu chơi quá chị
ơi""; ""Chờ đợi màn comeback từ chị quá. Mau mau ra video đập hộp xịn xò nha"";
""Cũng ước mơ có căn biệt thự giống Trinh mà chắc đi ngủ mới dám nghĩ tới"";
""Trinh vẫn đập hộp hay làm Tiktok vậy Trinh? Mà dù làm gì mình vẫn ủng hộ
Trinh hết mình""... là những bình luận của dân mạng.

Trong clip đập hộp cách đây không lâu, Ngọc Trinh khẳng định những món đồ dưới
1 tỉ cô mua được ngay, không cần suy nghĩ nhiều, nhưng vài tỉ thì cần phải cân
nhắc. ""Tôi không phải máy in tiền mà nói một cái có 4 - 5 tỉ mua đồ luôn. Tôi
cũng phải trúng show này, bán căn nhà kia mới có tiền"", Ngọc Trinh từng tâm
sự.

![Sau cách ly, Ngọc Trinh gom tiền đầu tư YouTube - Ảnh
3.](https://nld.mediacdn.vn/thumb_w/684/2020/6/6/ngoc-
trinh-8-15914093007451431130311-1591412689715175284661.png)

Dù còn lâu mới có thể so sánh, nhưng có Ngọc Trinh đang đi theo hướng của bà
hoàng hàng hiệu Jamie Chua

Thùy Trang

[

Chia sẻ

](javascript:;)

[ ![](https://nld.mediacdn.vn/web_images/icon-print-3.png)
](/Print.aspx?NewsID=20200606091334896 ""Print"")

"
06/08/2020,Người Việt ốp hàng rào bằng vỏ iPhone,https://nld.com.vn/cong-nghe/nguoi-viet-op-hang-rao-bang-vo-iphone-20200608103707503.htm,"##  Một người dùng TikTok Việt Nam chia sẻ video bờ rào, cổng nhà được ốp bằng
iPhone khiến cộng đồng mạng thế giới trầm trồ.

","Theo Khương Nha (Sohoa)

",,,"Video được đăng tải bởi tài khoản TikTok Nguyễn Minh Hiền ở Vĩnh Long. Thay vì
dùng gạch men để ốp hàng rào, người này dùng hàng nghìn vỏ iPhone để thay thế.
Hầu hết là vỏ của iPhone 6, một vài chiếc là iPhone 7 và 7 Plus.  

Video của anh Hiền được Ben Geskin, một nhân vật nổi tiếng trong giới công
nghệ thế giới, đưa lên Twitter với lời tweet: ""Người Việt Nam xây hàng rào từ
iPhone cũ"". Video lập tức khiến người dùng mạng xã hội xôn xao, được hơn 5.000
lượt thích, 130.000 lượt xem và 1.000 lượt retweet trong 2 ngày. Trang
_Mobygeek_ đã __ đăng lại video này.

Người dùng khắp thế giới tỏ ra thích thú với hàng rào bằng iPhone. ""Đây có vẻ
là một làng quê, nhưng làm sao ở nơi bình thường này người ta lại 'chịu chơi'
như vậy? Có phải thật không hay chỉ là miếng dán?"", tài khoản Mubashir bình
luận. Nhiều người cũng cho rằng đây chỉ là một loại miếng dán vì số lượng
iPhone để phủ kín bờ rào và hai cổng này phải lên đến hàng nghìn chiếc.  

""Tôi đã đến tận nơi để xem, là vỏ iPhone thật, không phải đồ giả"", người dùng
Trungkien bình luận. ""Nếu để ý kỹ sẽ thấy logo ""táo khuyết"" của Apple phản
quang theo góc nhìn khác nhau, đây đúng là vỏ iPhone thật rồi"", Anmol
Manchanda bình luận.

Video hàng rào iPhone của anh Nguyễn Minh Hiền

Theo anh Hiền, chủ nhân của ""tác phẩm"" độc đáo này. Toàn bộ iPhone để ốp tường
rào là mãy cũ được ""rã"" linh kiện, màn hình để lấy vỏ. Chi phí xây hàng rào
này khoảng 250 triệu đồng. ""Sau 15 năm làm nghề sửa điện thoại, cuối cùng tôi
cũng có được hàng rào ưng ý"", anh Hiền mô tả ngắn ngọn về hàng rào ốp iPhone
của mình.

Ở Việt Nam, dòng iPhone 6, 7 vẫn khá phổ biến và được người dùng phổ thông tìm
mua nhiều. Hầu hết là điện thoại tân trang, được nhập về từ nhiều nguồn, phần
lớn từ Trung Quốc. Lượng vỏ iPhone khổng lồ để ốp hàng rào này cũng khiến
nhiều người lo ngại về rác thải công nghiệp ở những quốc gia đang phát triển,
như Việt Nam, Ấn Độ.

Theo Khương Nha (Sohoa)

[

Chia sẻ

](javascript:;)

[ ![](https://nld.mediacdn.vn/web_images/icon-print-3.png)
](/Print.aspx?NewsID=20200608103707503 ""Print"")

"
