date,title,original_link,subhead,author,source,pic_list,body
18/06/2020,"Ngăn chặn hàng chục thanh, thiếu niên và học sinh chuẩn bị hỗn chiến",https://nld.com.vn/phap-luat/ngan-chan-hang-chuc-thanh-thieu-nien-va-hoc-sinh-chuan-bi-hon-chien-20200618105938815.htm,"##  (NLĐO) – Nhóm hàng chục thanh, thiếu niên và học sinh đang chuẩn bị hung
khí để hỗn chiến thì lực lượng công an phát hiện và ngăn chặn kịp thời

","Cao Nguyên

",,"https://nld.mediacdn.vn/thumb_w/684/2020/6/18/820720237357875805103636213154469104158269n-15924524928431079437502.jpg|Ngăn chặn hàng chục thanh, thiếu niên và học sinh chuẩn bị hỗn chiến - Ảnh 1.&&https://nld.mediacdn.vn/thumb_w/684/2020/6/18/104344831596047454650569797152705597299066n-15924525477871231422490.jpg|Ngăn chặn hàng chục thanh, thiếu niên và học sinh chuẩn bị hỗn chiến - Ảnh 2.&&https://nld.mediacdn.vn/thumb_w/684/2020/6/18/1054874473787477964185887156920362342116065n-15924525862531869362645.jpg|Ngăn chặn hàng chục thanh, thiếu niên và học sinh chuẩn bị hỗn chiến - Ảnh 3.&&https://nld.mediacdn.vn/thumb_w/684/2020/6/18/96086310194016055239000891424111938698149n-1592452628891400630264.jpg|Ngăn chặn hàng chục thanh, thiếu niên và học sinh chuẩn bị hỗn chiến - Ảnh 4.","Sáng 18-6, tin từ Phòng Cảnh sát cơ động, Công an tỉnh Đắk Lắk đang tiếp tục
củng cố hồ sơ để xử lý nhóm thanh, thiếu niên và học sinh mang nhiều loại hung
khí tụ tập chuẩn bị [hỗn chiến](https://nld.com.vn/hon-chien.html ""hỗn
chiến"").  

![Ngăn chặn hàng chục thanh, thiếu niên và học sinh chuẩn bị hỗn chiến - Ảnh
1.](https://nld.mediacdn.vn/thumb_w/684/2020/6/18/820720237357875805103636213154469104158269n-15924524928431079437502.jpg)

Nhóm thanh, thiếu niên và học sinh chuẩn bị đi hỗn chiến

Trước đó, khuya 17-6, trang Zalo của Phòng Cảnh sát cơ động, Công an tỉnh Đắk
Lắk nhận được thông báo có một nhóm thanh, thiếu niên và học sinh mang theo
hung khí đang tụ tập tại khu đất trống, gần Trường mầm non Hello Kitty (đường
Hà Huy Tập, TP Buôn Ma Thuột, tỉnh Đắk Lắk) để chuẩn bị đi hỗn chiến.

![Ngăn chặn hàng chục thanh, thiếu niên và học sinh chuẩn bị hỗn chiến - Ảnh
2.](https://nld.mediacdn.vn/thumb_w/684/2020/6/18/104344831596047454650569797152705597299066n-15924525477871231422490.jpg)

Lực lượng Cảnh sát cơ động đã có mặt kịp thời, ngăn vụ hỗn chiến

Ngay lập tức, Phòng Cảnh sát cơ động, Công an tỉnh Đắk Lắk đã triển khai lực
lượng đến hiện trường. Tại đây, lực lượng công an phát hiện có hơn 30 người
mang theo dao rựa, mã tấu các loại. Do vậy, tổ công tác đã triển khai lực
lượng vây ráp, bắt giữ 21 người, 7 xe máy, số còn lại đã nhanh chóng bỏ chạy.

![Ngăn chặn hàng chục thanh, thiếu niên và học sinh chuẩn bị hỗn chiến - Ảnh
3.](https://nld.mediacdn.vn/thumb_w/684/2020/6/18/1054874473787477964185887156920362342116065n-15924525862531869362645.jpg)

Nhóm thanh, thiếu niên và học sinh chuẩn bị nhiều hung khí đi hỗn chiến

Qua xác minh, số thanh, thiếu niên này tuổi đời còn rất trẻ, từ 15 đến 18 tuổi
và chủ yếu là học sinh của các Trường THPT trên địa bàn TP Buôn Ma Thuột. Bước
đầu, các thanh, thiếu niên này khai nhận, do có mâu thuẫn với một nhóm thanh,
thiếu niên khác nên đã hẹn đêm 17-6 sẽ hỗn chiến để giải quyết mâu thuẫn.

![Ngăn chặn hàng chục thanh, thiếu niên và học sinh chuẩn bị hỗn chiến - Ảnh
4.](https://nld.mediacdn.vn/thumb_w/684/2020/6/18/96086310194016055239000891424111938698149n-1592452628891400630264.jpg)

Nhóm thanh, thiếu niên có tuổi đời chỉ từ 15 đến 18 tuổi

Sau khi đưa các trường hợp này đến Bệnh viện đa khoa TP Buôn Ma Thuột test
kiểm tra ma túy thì có một trường hợp là Đỗ Hoàng Phi H. (17 tuổi, học sinh
cấp 3) dương tính với chất ma túy.

Cao Nguyên

[

Chia sẻ

](javascript:;)

[ ![](https://nld.mediacdn.vn/web_images/icon-print-3.png)
](/Print.aspx?NewsID=20200618105938815 ""Print"")

"
27/06/2020,"Danh hài Hữu Nghĩa: Với học trò, tôi chưa bao giờ là ""trùm cuối""",https://nld.com.vn/van-nghe/danh-hai-huu-nghia-voi-hoc-tro-toi-chua-bao-gio-la-trum-cuoi-20200627091617694.htm,"##  (NLĐO) - Dàn dựng chương trình sân khấu ""Tuổi vào đời"" cho diễn viên trẻ
là học trò tham gia biểu diễn tại Sân khấu Hồng Vân - Chợ Lớn, đạo diễn - nghệ
sĩ hài Hữu Nghĩa đã trải lòng về phương pháp đào tạo trong thời công nghệ 4.0.

","Bài và ảnh: Thanh Hiệp

",,"https://nld.mediacdn.vn/thumb_w/684/2020/6/27/dsc04094-159322365953426933663.jpg|Danh hài Hữu Nghĩa: Với học trò, tôi chưa bao giờ là trùm cuối - Ảnh 1.&&https://nld.mediacdn.vn/thumb_w/684/2020/6/27/10635466411269930843493166835962358270729909n-1593223733851422867588.jpg|Danh hài Hữu Nghĩa: Với học trò, tôi chưa bao giờ là trùm cuối - Ảnh 2.&&https://nld.mediacdn.vn/thumb_w/684/2020/6/27/dsc03815-15932238337831390176164.jpg|Danh hài Hữu Nghĩa: Với học trò, tôi chưa bao giờ là trùm cuối - Ảnh 3.&&https://nld.mediacdn.vn/thumb_w/684/2020/6/27/dsc04062-1593224045656558650891.jpg|Danh hài Hữu Nghĩa: Với học trò, tôi chưa bao giờ là trùm cuối - Ảnh 4.","![Danh hài Hữu Nghĩa: Với học trò, tôi chưa bao giờ là trùm cuối - Ảnh
1.](https://nld.mediacdn.vn/thumb_w/684/2020/6/27/dsc04094-159322365953426933663.jpg)

Nghệ sĩ Hữu Nghĩa trong đêm diễn chương trình ""Tuổi vào đời""

""Tôi quý mến học trò, xem các em như người trong một gia đình. Giai đoạn khó
khăn trăm bề, nhiều em từ Hà Nội, Huế vào đây học. Các em đam mê là một
chuyện, rồi đụng phải khó khăn mới thấy con đường làm diễn viên rất nghiệt
ngã, khi mà sân khấu kịch đã thoái trào, nhiều thử thách. Nghề diễn viên có
thể vận dụng ở nhiều sân chơi: game show, truyền hình thực tế, phim truyền
hình, điện ảnh… nhưng để chạm tay đến thành công, không còn như trước đây nữa,
vì mỗi bộ môn đều gặp phải vấn đề: cạn kiệt đề tài. Do đó, tôi chưa bao giờ là
""trùm cuối"" với các em"" - nghệ sĩ Hữu Nghĩa chia sẻ.

![Danh hài Hữu Nghĩa: Với học trò, tôi chưa bao giờ là trùm cuối - Ảnh
2.](https://nld.mediacdn.vn/thumb_w/684/2020/6/27/10635466411269930843493166835962358270729909n-1593223733851422867588.jpg)

NSND Hồng Vân và nghệ sĩ Hữu Nghĩa nhận hoa chúc mừng của đại diện diễn viên
khóa K 13 sau đêm diễn chương trình ""Tuổi vào đời""

Hai chữ ""trùm cuối"" đối với suy nghĩ của nghệ sĩ Hữu Nghĩa nghĩa là mát tay,
dạy đâu thắng đó, học trò chỉ cần thọ giáo anh thì sẽ thành công. ""Tôi muốn
các em học tập thật nhiều ở các đồng nghiệp của tôi - bằng cách xem, thẩm thấu
những vở diễn chuyên nghiệp, để học và trải nghiệm, còn lại là thời gian thực
hành qua các chương trình sân khấu mà tôi dàn dựng. Mừng khi bên cạnh lúc nào
cũng có NSND Hồng Vân, NSND Việt Anh, NSƯT Hữu Châu, nghệ sĩ Thanh Thủy… đồng
hành để cho các em nhiều bài học quý"" - anh bộc bạch.

![Danh hài Hữu Nghĩa: Với học trò, tôi chưa bao giờ là trùm cuối - Ảnh
3.](https://nld.mediacdn.vn/thumb_w/684/2020/6/27/dsc03815-15932238337831390176164.jpg)

Tiểu phẩm ""Tình thương"" lấy nước mắt khán giả với sự thể hiện của Quỳnh Anh,
Thành Phương, Thị Bích

Với 12 tiểu phẩm mang chủ đề ""Tuổi vào đời"", lứa học trò khóa K13 của nghệ sĩ
Hữu Nghĩa đã thể hiện thật tốt cảm xúc qua từng vai diễn. ""Vì đạo diễn chọn
đúng chiếc áo để các em mặc thật vừa vặn nên vai nào cũng hay, cũng đem lại
cảm xúc chân thật cho người xem"" - NSND Hồng Vân nhận xét.

![Danh hài Hữu Nghĩa: Với học trò, tôi chưa bao giờ là trùm cuối - Ảnh
4.](https://nld.mediacdn.vn/thumb_w/684/2020/6/27/dsc04062-1593224045656558650891.jpg)

NSND Hồng Vân tặng hoa chúc mừng nghệ sĩ Hữu Nghĩa

Đó là những câu chuyện về tình người, về tuổi mới lớn trước những suy nghĩ về
cuộc sống. Bằng thủ pháp hài hước hóa những góc nhìn của tuổi mới lớn, nghệ sĩ
Hữu Nghĩa đã tạo nên một không gian rất ấm áp, để các bạn trẻ hòa mình vào
nhân vật, mang đến sự thú vị trong cách kể chuyện của từng tiểu phẩm.

""Công nghệ 4.0 cho phép các em diễn viên bây giờ tiếp cận nhiều loại hình, chỉ
cần chạm tay nhẹ là được xem. Thế nhưng, tôi chủ trương hướng các em đi xem ở
nhiều sàn diễn, để biết cách tương tác, giao lưu, áp dụng những đơn nguyên
được học một cách hữu hiệu. Lời dặn dò đó đã thành bài học, để học trò tôi
luôn khao khát được trải nghiệm dù con đường phía trước còn nhiều chông gai"" -
nghệ sĩ Hữu Nghĩa bày tỏ.

Bài và ảnh: Thanh Hiệp

[

Chia sẻ

](javascript:;)

[ ![](https://nld.mediacdn.vn/web_images/icon-print-3.png)
](/Print.aspx?NewsID=20200627091617694 ""Print"")

"
06/07/2020,Trường ĐH Duy Tân: Trao bằng tốt nghiệp cho 281 Thạc sĩ,https://nld.com.vn/giao-duc-khoa-hoc/truong-dh-duy-tan-trao-bang-tot-nghiep-cho-281-thac-si-20200607115316654.htm,"##  (NLĐO)- Bên cạnh 281 Thạc sĩ thuộc 5 chuyên ngành đào tạo, ĐH Duy Tân còn
trao bằng tốt nghiệp cho 1.442 sinh viên tại lễ ""Trao bằng tốt nghiệp cho Kiến
trúc sư, Kỹ sư, Dược sĩ, Cử nhân Đại học năm 2019 – 2020"".

","Q. Luật

",,https://nld.mediacdn.vn/thumb_w/684/2020/6/7/hinh-1-2-15915054612751113298882.jpg|Trường ĐH Duy Tân: Trao bằng tốt nghiệp cho 281 Thạc sĩ - Ảnh 1.&&https://nld.mediacdn.vn/thumb_w/684/2020/6/7/hinh-2-15915054795001671666678.jpg|Trường ĐH Duy Tân: Trao bằng tốt nghiệp cho 281 Thạc sĩ - Ảnh 2.,"Ngày 7-6, Trường ĐH Duy Tân đã tổ chức lễ ""Trao bằng tốt nghiệp Thạc sĩ, Kiến
trúc sư, Kỹ sư, Dược sĩ, Cử nhân Đại học năm 2019 – 2020"" cho 281 Thạc sĩ
thuộc 5 chuyên ngành và 1.442 sinh viên tốt nghiệp (chiếm tỷ lệ 69% sinh viên
tham gia tốt nghiệp năm 2020). Trong đó, số sinh viên tốt nghiệp loại Xuất sắc
là 85 sinh viên,chiếm tỷ lệ 5,9% và 10 sinh viên tốt nghiệp sớm trước 6 tháng.  

![Trường ĐH Duy Tân: Trao bằng tốt nghiệp cho 281 Thạc sĩ - Ảnh
1.](https://nld.mediacdn.vn/thumb_w/684/2020/6/7/hinh-1-2-15915054612751113298882.jpg)

ĐH Duy Tân trao bằng tốt nghiệp cho 281 Thạc sĩ và 1.442 sinh viên năm học
2019-2020

Phát biểu tại buổi lễ, TS. Võ Thanh Hải, Phó hiệu trưởng thường trực Trường ĐH
Duy Tân cho biết năm học 2019 – 2020 là năm học đặc biệt, nhiều hoạt động dạy,
học bị trì hoãn do ảnh hưởng của đại dịch Covid-19. Tuy nhiên, nhà trường cùng
toàn thể học sinh đều quyết tâm, phấn đấu vượt qua những khó khăn của dịch
bệnh. ""Trường ĐH Duy Tân vinh hạnh là trường ĐH đầu tiên trên cả nước tổ chức
lễ tốt nghiệp năm học 2019-2020, cũng như là trường ĐH đầu tiên tổ chức Ngày
hội việc làm 2020"" – TS. Võ Thanh Hải chia sẻ.

![Trường ĐH Duy Tân: Trao bằng tốt nghiệp cho 281 Thạc sĩ - Ảnh
2.](https://nld.mediacdn.vn/thumb_w/684/2020/6/7/hinh-2-15915054795001671666678.jpg)

Nhà giáo ưu tú, Anh hùng Lao động, Lê Công Cơ, Chủ tịch Hội đồng Trường,
Trường Đại học Duy Tân trao bằng cho sinh viên tốt nghiệp loại xuất sắc trường
ĐH Duy Tân

Cũng trong năm học 2019 – 2020, Trường ĐH Duy Tân được công nhận là trường ĐH
tư thục đầu tiên của Việt Nam được QS Ranking xếp hạng Top 500 trường đại học
tốt nhất châu Á; là đại học thứ 2 của Việt Nam đạt kiểm định ABET cho chương
trình Kỹ thuật Mạng và Hệ thống Thông tin Quản lý; là 1 trong 3 trường đại học
có công bố quốc tế nhiều nhất Việt Nam. Mới đây, trường ĐH Duy Tân được Nhà
nước trao tặng Huân chương Lao động hạng Nhất.

Trước đó, chương trình Ngày hội việc làm 2020 do trường ĐH Duy Tân phối hợp
báo Người lao động tổ chức đã thu hút 65 doanh nghiệp ở các lĩnh vực nghành
nghề với 40 gian hàng và 2.124 vị trí tuyển dụng, trong đó có 18 doanh nghiệp
là của các cựu sinh viên Duy Tân. Bên cạnh đó, ĐH Duy Tân cũng ra mắt Câu lạc
bộ Doanh nhân Cựu sinh viên Đại học Duy Tân nhằm ủng hộ tinh thần khởi nghiệp,
hỗ trợ sinh viên kiếm việc làm, hỗ trợ sinh viên có hoàn cảnh khó khăn,…

Q. Luật

[

Chia sẻ

](javascript:;)

[ ![](https://nld.mediacdn.vn/web_images/icon-print-3.png)
](/Print.aspx?NewsID=20200607115316654 ""Print"")

"
30/06/2020,Đại sứ Mỹ thăm cầu Hàm Rồng cùng cựu chiến binh Việt Nam,https://nld.com.vn/chinh-tri/dai-su-my-tham-cau-ham-rong-cung-cuu-chien-binh-viet-nam-20200630181508697.htm,"##  (NLĐO)- Trong chuyến trong chuyến công tác tại tỉnh Thanh Hóa và Ninh
Bình, Đại sứ Mỹ tại Việt Nam Daniel J. Kritenbrink đã tới tham quan Cầu Hàm
Rồng với các cựu chiến binh Mỹ và Việt Nam, trong đó có những người đã chiến
đấu bảo vệ cầu trong chiến tranh.

","D.Ngọc

",,https://nld.mediacdn.vn/thumb_w/684/2020/6/30/photo-4-15935151901201289023949.jpg|Đại sứ Mỹ thăm cầu Hàm Rồng cùng cựu chiến binh Việt Nam - Ảnh 1.&&https://nld.mediacdn.vn/thumb_w/684/2020/6/30/photo-5-15935154839961226014583.jpg|Đại sứ Mỹ thăm cầu Hàm Rồng cùng cựu chiến binh Việt Nam - Ảnh 2.&&https://nld.mediacdn.vn/thumb_w/684/2020/6/30/photo-1-1593515257408840624495.jpg|Đại sứ Mỹ thăm cầu Hàm Rồng cùng cựu chiến binh Việt Nam - Ảnh 3.&&https://nld.mediacdn.vn/thumb_w/684/2020/6/30/photo-2-15935153354021392451111.jpg|Đại sứ Mỹ thăm cầu Hàm Rồng cùng cựu chiến binh Việt Nam - Ảnh 4.&&https://nld.mediacdn.vn/thumb_w/684/2020/6/30/photo-3-1593515375261379176888.jpg|Đại sứ Mỹ thăm cầu Hàm Rồng cùng cựu chiến binh Việt Nam - Ảnh 5.,"Thông tin từ Đại sứ quán Mỹ tại Việt Nam ngày 30-6 cho biết [**Đại sứ
Mỹ**](https://nld.com.vn/dai-su-my.html ""Đại sứ Mỹ"") tại Việt Nam Daniel J.
Kritenbrink vừa có chuyến công tác tại tỉnh Thanh Hóa và Ninh Bình. Trong
chuyến công tác, Đại sứ Kritenbrink đã tham quan cầu Hàm Rồng với các cựu
chiến binh Mỹ và Việt Nam, trong đó có những người đã chiến đấu bảo vệ cầu
trong chiến tranh.

![Đại sứ Mỹ thăm cầu Hàm Rồng cùng cựu chiến binh Việt Nam - Ảnh
1.](https://nld.mediacdn.vn/thumb_w/684/2020/6/30/photo-4-15935151901201289023949.jpg)

Đại sứ Daniel Kritenbrink gặp mặt các cựu chiến binh Việt Nam tại Cầu Hàm
Rồng. Một số cựu chiến binh có mặt tại cuộc gặp gỡ này từng chiến đấu để bảo
vệ cây cầu trong chiến tranh - Ảnh: Đại sứ quán Mỹ tại Việt Nam

Đại sứ Kritenbrink, phái đoàn của Đại sứ quán Mỹ và các cựu chiến binh Việt
Nam và Mỹ, và đại diện tỉnh Thanh Hóa đã gặp gỡ, trao đổi và chụp ảnh kỷ niệm
trên cầu Hàm Rồng gần TP Thanh Hoá.

Cuộc giao lưu của các cựu chiến binh Mỹ và Việt Nam tại cây cầu từng là điểm
giao tranh ác liệt trong chiến tranh là một biểu trưng của nỗ lực hòa giải và
cho thấy hai nước đã làm được rất nhiều điều trong việc xử lý những vấn đề
chiến tranh để lại.

![Đại sứ Mỹ thăm cầu Hàm Rồng cùng cựu chiến binh Việt Nam - Ảnh
2.](https://nld.mediacdn.vn/thumb_w/684/2020/6/30/photo-5-15935154839961226014583.jpg)

Đại sứ Kritenbrink, phái đoàn của Đại sứ quán Mỹ và các cựu chiến binh Việt
Nam và Mỹ, và đại diện tỉnh Thanh Hóa chụp ảnh kỷ niệm trên cầu Hàm Rồng gần
TP Thanh Hoá

Đại sứ Kritenbrink cũng tới thăm Trường mầm non Quảng Trung được xây dựng với
nguồn Hỗ trợ Nhân đạo của Bộ Quốc phòng Mỹ vào năm 2012, tới chào Bí thư Tỉnh
ủy Thanh Hóa và Chủ tịch UBND tỉnh Thanh Hóa, phát biểu tại Lễ khai giảng
Chương trình Học bổng Tiếng Anh Access tại Trường PTTH Dân tộc Nội trú tỉnh
Thanh Hóa, nói chuyện cùng giáo viên và học sinh tại Trường chuyên Lam Sơn,
gặp gỡ cựu sinh của các chương trình trao đổi của Chính phủ Mỹ, và thăm nhà
thờ Phát Diệm.  

Chuyến thăm tỉnh Thanh Hóa và Ninh Bình của Đại sứ Kritenbrink tái khẳng định
cam kết của Mỹ trong quan hệ đối tác với Việt Nam. ""Năm nay chúng ta kỷ niệm
1/4 thế kỷ quan hệ đối tác, và chúng ta hãy cũng nhau tái khẳng định cam kết
hợp tác để đảm bảo một tương lai tươi sáng, hòa bình và thịnh vượng cho nhân
dân Việt Nam và Mỹ. Bởi chúng ta biết: Là đối tác tin cậy, chúng ta sẽ cùng
nhau thịnh vượng"" - Đại sứ Kritenbrink khẳng định.

![Đại sứ Mỹ thăm cầu Hàm Rồng cùng cựu chiến binh Việt Nam - Ảnh
3.](https://nld.mediacdn.vn/thumb_w/684/2020/6/30/photo-1-1593515257408840624495.jpg)

Đại sứ Daniel Kritenbrink và đại diện tỉnh Thanh Hóa cắt băng khánh thành dự
án Tu sửa mái vòm và Bảo tồn cổng thành phía Nam của Thành nhà Hồ do Quỹ Bảo
tồn Văn hóa của Đại sứ Mỹ tài trợ.

Trong chuyến công tác, Đại sứ Kritenbrink đã dự lễ khánh thành dự án bảo tồn
di sản Cổng Nam, Thành Nhà Hồ do Quỹ Bảo tồn Văn hóa của Đại sứ Mỹ (AFCP) tài
trợ.

Do nhà Hồ xây dựng năm 1397 làm kinh đô của nước Đại Ngu, Thành Nhà Hồ độc đáo
ở kỹ thuật xây dựng nổi bật, sử dụng các khối đá lớn nặng từ 10 đến 26 tấn,
được gia công phẳng phiu, xếp khít nhau và chồng lên nhau tới độ cao gần 10
mét. Hoàng Thành đóng vai trò là một thành trì quân sự để bảo vệ đất nước khỏi
ngoại xâm, và do đó trở thành biểu tượng của tinh thần yêu nước, và là nhân
chứng của lịch sử Việt Nam trong giai đoạn cuối thế kỷ 14 đầu thể kỷ 15.

![Đại sứ Mỹ thăm cầu Hàm Rồng cùng cựu chiến binh Việt Nam - Ảnh
4.](https://nld.mediacdn.vn/thumb_w/684/2020/6/30/photo-2-15935153354021392451111.jpg)

Đại sứ Kritenbrink theo dõi phần giới thiệu về lịch sử Thành nhà Hồ - Ảnh: Đại
sứ quán Mỹ tại Việt Nam cung cấp

Quỹ Bảo tồn Văn hóa của Đại sứ Mỹ (AFCP) đã thông qua khoản tài trợ trị giá
92.500 USD để bảo tồn Cổng Nam, công trình quan trọng nhất còn lại của Thành
Nhà Hồ nhưng đã bị hư hại nghiêm trọng theo thời gian. Mái vòm phía tây (bên
trái) của Cổng Nam có nguy cơ sụt vỡ do phiến đá đỉnh bị nứt và trở nên lỏng
lẻo, đe dọa sự an toàn của du khách cũng như cấu trúc tổng thể của cổng thành.
Dự án đưa phiến đá về vị trí cũ bắt đầu từ tháng 12-2018 với sự giám sát của
chuyên gia bảo tồn di sản người Thụy Sĩ gốc Việt Vũ Nam Sơn, và Trung tâm quản
lý di sản Thành nhà Hồ.

Phát biểu tại lễ khánh thành vào ngày 29-6, Đại sứ Kritenbrink nói: ""Thông qua
tìm hiểu về quá trình xây dựng, sơ đồ và đặt tòa thành trong cảnh quan tự
nhiên, cũng như công tác tổ chức cần thiết cho việc xây dựng thành, chúng ta
biết được rất nhiều về những người đã xây dựng thành nhà Hồ cũng như xã hội
của họ. Đó thực sự là một phần di sản của toàn nhân loại.""

![Đại sứ Mỹ thăm cầu Hàm Rồng cùng cựu chiến binh Việt Nam - Ảnh
5.](https://nld.mediacdn.vn/thumb_w/684/2020/6/30/photo-3-1593515375261379176888.jpg)

Đại sứ Daniel Kritenbrink, phái đoàn của Đại sứ quán Mỹ và các cựu chiến binh
Mỹ tới thăm Trường mầm non Quảng Trung được xây dựng với nguồn Hỗ trợ Nhân đạo
của Bộ Quốc phòng Mỹ

Lễ khánh thành là một phần trong số những hoạt động của Phái đoàn Ngoại giao
Mỹ nhằm kỷ niệm 25 năm quan hệ ngoại giao Mỹ-Việt Nam. Đại sứ Kritenbrink cho
biết: ""Bảo tồn di sản văn hóa chỉ là một trong nhiều lĩnh vực hợp tác giữa hai
nước chúng ta. Trên các lĩnh vực đa dạng như thương mại, phát triển, giáo dục,
y tế, năng lượng và an ninh, Mỹ cùng một nước Việt Nam vững mạnh và độc lập
đang hợp tác với một cam kết chung vì hòa bình và thịnh vượng"".

D.Ngọc

[

Chia sẻ

](javascript:;)

[ ![](https://nld.mediacdn.vn/web_images/icon-print-3.png)
](/Print.aspx?NewsID=20200630181508697 ""Print"")

"
06/10/2020,Đối tượng 2 lần giết người được đưa đi chữa bệnh tâm thần,https://nld.com.vn/thoi-su/doi-tuong-2-lan-giet-nguoi-duoc-dua-di-chua-benh-tam-than-20200610101459431.htm,"##  (NLĐO) – Đối tượng Tý Cưng đã 2 lần giết người đã khai từng điều trị bệnh
tâm thần. Kết quả giám định xác định đối tượng bị trầm cảm, có dấu hiệu bệnh
tâm thần.

","Chí Phong

",,https://nld.mediacdn.vn/thumb_w/684/2020/6/10/doi-tuong-tieu-duy-dung-anh-co-quan-cong-an-cung-cap-15917587492351546543701.jpg|Đối tượng 2 lần giết người được đưa đi chữa bệnh tâm thần - Ảnh 1.,"Ngày 10-6, nguồn tin phóng viên Báo Người Lao Động cho biết VKSND tỉnh Gia Lai
đã ký quyết định đưa bị can Tiêu Duy Dũng (tự Tý Cưng, SN 1983, trú tại tổ 14,
phường Yên Đỗ, TP. Pleiku) đi chữa bệnh bắt buộc tại Viện Pháp y tâm thần
Trung ương Biên Hòa (tỉnh Đồng Nai).  

Tý Cưng là đối tượng có nhiều tiền án về các tội ""Gây rối trật tự công cộng"",
""Cướp tài sản"", ""Cố ý gây thương tích"".

Điển hình là ngày 5-6-2009, Tý Cưng dùng dao đâm chết anh Nguyễn Trường Ca
(tức Ca tẩu, SN 1978, trú tại tổ 2, phường Yên Thế, TP. Pleiku). Tuy nhiên,
trong quá trình điều tra, Nguyễn Anh Duy (SN 1992) lúc đó là học sinh lớp 11
đã ra đầu thú, nhận tội thay. Sau đó, cơ quan công an điều tra và xác định Tý
Cưng mới là hung thủ trực tiếp gây án.

![Đối tượng 2 lần giết người được đưa đi chữa bệnh tâm thần - Ảnh
1.](https://nld.mediacdn.vn/thumb_w/684/2020/6/10/doi-tuong-tieu-duy-dung-anh-
co-quan-cong-an-cung-cap-15917587492351546543701.jpg)

Đối tượng Tý Cưng được đưa đi chữa bệnh tâm thần - Ảnh công an cung cấp

Rạng sáng 2-7-2019, Tý Cưng dùng súng bắn chết anh Trần Minh Tấn (SN 1997) và
bắn bị thương anh Nguyễn Thành Vũ (SN 1995, cùng trú phường Yên Đỗ, TP Pleiku.  

Trong quá trình điều tra vụ án này, Tý Cưng khai từng đi điều trị bệnh tâm
thần tại Viện Pháp y tâm thần Trung ương Biên Hòa nên yêu cầu và được cho đi
giám định pháp y tâm thần.  

Kết quả xác định Tý Cưng bị trầm cảm, có dấu hiệu tâm thần. Căn cứ theo kết
quả giám định pháp y tâm thần, Viện Kiểm sát nhân dân tỉnh đã ký quyết định
đưa bị can đi chữa bệnh bắt buộc. Sau khoảng thời gian chữa bệnh, bị can sẽ
tiếp tục phải chịu trách nhiệm hình sự. Theo Điều 49 Bộ Luật Hình sự 2015,
thời gian bắt buộc chữa bệnh được trừ vào thời hạn chấp hành hình phạt tù.  

 ****

Chí Phong

[

Chia sẻ

](javascript:;)

[ ![](https://nld.mediacdn.vn/web_images/icon-print-3.png)
](/Print.aspx?NewsID=20200610101459431 ""Print"")

"
