date,title,original_link,subhead,author,source,pic_list,body
14/03/2020,"Hồ Ngọc Hà, Chi Pu quyên góp 4 tỉ chống Covid-19 và hạn mặn",https://nld.com.vn/van-nghe/chi-pu-quyen-gop-1-ti-dong-chong-covid-19-202003140758139.htm,"##  (NLĐO) - Sau Hà Anh Tuấn, Chi Pu là nghệ sĩ thứ 2 đóng góp số tiền lớn
tham gia phòng chống dịch Covid-19. Trong khi đó, Hồ Ngọc Hà cũng đóng góp và
vận động 3 tỉ đồng chống dịch và hạn mặn...

","Thùy Trang - Yến Anh; ảnh NVCC

",,"https://nld.mediacdn.vn/thumb_w/684/2020/3/14/batchtn21671-15841473674201609352163.jpg|Hồ Ngọc Hà, Chi Pu quyên góp 4 tỉ chống Covid-19 và hạn mặn - Ảnh 1.&&https://nld.mediacdn.vn/thumb_w/684/2020/3/14/batchtn21616-1584147367424269390912.jpg|Hồ Ngọc Hà, Chi Pu quyên góp 4 tỉ chống Covid-19 và hạn mặn - Ảnh 2.&&https://nld.mediacdn.vn/thumb_w/684/2020/3/14/anh-chup-man-hinh-2020-03-14-luc-154717-1584175799234684721369.png|Hồ Ngọc Hà, Chi Pu quyên góp 4 tỉ chống Covid-19 và hạn mặn - Ảnh 3.&&https://nld.mediacdn.vn/thumb_w/684/2020/3/14/anh-chup-man-hinh-2020-03-14-luc-154012-15841756564152037286512.png|Hồ Ngọc Hà, Chi Pu quyên góp 4 tỉ chống Covid-19 và hạn mặn - Ảnh 4.&&https://nld.mediacdn.vn/thumb_w/684/2020/3/14/hoang-thuy-linh-15841758319331297793193.jpg|Hồ Ngọc Hà, Chi Pu quyên góp 4 tỉ chống Covid-19 và hạn mặn - Ảnh 5.","![Hồ Ngọc Hà, Chi Pu quyên góp 4 tỉ chống Covid-19 và hạn mặn - Ảnh
1.](https://nld.mediacdn.vn/thumb_w/684/2020/3/14/batchtn21671-15841473674201609352163.jpg)

Chi Pu là nghệ sĩ thứ 2, sau Hà Anh Tuấn đóng góp số tiền lớn đề chống dịch
Covid-19

Số tiền 1 tỉ đồng sẽ được chi cho việc nhập khẩu máy móc, thiết bị và chi phí
lắp đặt một phòng cách ly áp lực âm cùng 5.000 bộ trang phục bảo hộ phòng dịch
trang bị cho các bác sĩ, nhân viên y tế.

Ca sĩ Chi Pu đã liên hệ với cố vấn chuyên môn y khoa của đơn vị sản xuất phòng
cách ly áp lực âm để xúc tiến việc nhập khẩu trang thiết bị và triển khai lắp
đặt tại một bệnh viện ở Hà Nội.

Về trang phục bảo hộ phòng dịch, Chi Pu sẽ trực tiếp đi tặng và bàn giao cho
người đại diện ở nhiều bệnh viện trên cả nước.

Đại diện nữ ca sĩ cho biết đã liên hệ với Sở Y tế TP Hà Nội và được tiếp nhận
nhiệt tình cũng như tạo điều kiện thuận lợi trong việc kết nối với nhiều bệnh
viện trên địa bàn thành phố, chuẩn bị cho công tác tiếp sức.

'Chi liên tục theo dõi thông tin diễn biến phức tạp của đại dịch Covid-19 và
thấy rằng các cơ quan chức năng, ban ngành đoàn thể liên quan đã và đang nỗ
lực rất tốt từng ngày để ngăn chặn dịch bệnh lan truyền tại Việt Nam. Chi nghĩ
đã đến lúc bản thân nói riêng và mỗi công dân nói chung cần hành động để chung
tay góp phần đẩy lùi nạn dịch. Phần đóng góp tuy nhỏ bé nhưng Chi hy vọng
không chỉ có mình mà còn nhiều người hơn nữa sẽ cùng góp sức để tiếp thêm sức
mạnh cho Việt Nam, vì một cộng đồng luôn khoẻ mạnh. Chi tin rằng nếu toàn dân
đồng lòng chống dịch, nhất định chúng ta sẽ thành công' - Chi Pu bày tỏ.

![Hồ Ngọc Hà, Chi Pu quyên góp 4 tỉ chống Covid-19 và hạn mặn - Ảnh
2.](https://nld.mediacdn.vn/thumb_w/684/2020/3/14/batchtn21616-1584147367424269390912.jpg)

Chi Pu quyên góp 1 tỉ đồng tặng phòng áp lực âm và 5000 bộ đồ bảo hộ phòng
dịch

Ca sĩ Min cũng đã đóng góp 10.000 chiếc khẩu trang và 500 chai nước rửa tay
cho Bệnh viện Nhiệt đới Trung Ương để hỗ trợ cho các y bác sĩ và bệnh nhân bảo
hộ bản thân trong mùa dịch. Chiều 13-3, đại diện nữ ca sĩ đã đến trao tặng
Bệnh viện Bệnh Nhiệt đới Trung ương. Đây là những món quà vô cùng ý nghĩa
trong thời điểm dịch Covid-19 bùng phát.

""Được biết các bệnh viện hiện tại cũng không đủ nhân lực và hàng cũng khan
hiếm nên sẽ tốt hơn nếu mình quyên góp vật phẩm. Mỗi người đóng góp ít hay
nhiều đều rất đáng trân trọng. Min sẽ tiếp tục những gì mình có thể làm để
cùng chung tay với mọi người. Việt Nam cố lên"" - Min kêu gọi trên trang cá
nhân.

Trong khi đó, [Hồ Ngọc Hà](https://nld.com.vn/ho-ngoc-ha.html ""Hồ Ngọc Hà"")
cho biết cô và nhà thiết kế Lý Quí Khánh đã đóng góp, kêu gọi nhiều đồng
nghiệp, bạn bè hỗ trợ. Đến sáng 14-3, cô đã quyên được 3 tỉ đồng, trong đó 2
tỉ tiền mặt nữ ca sĩ giúp đỡ người dân miền Tây gặp khó khăn do hạn mặn. Cụ
thể, Hồ Ngọc Hà tặng một tỉ đồng tiền mặt và ba hệ thống lọc nước với trị giá
một tỉ đồng.  

Ê-kíp của cô đã về Bến Tre, Long An, Tiền Giang... khảo sát, lên kế hoạch đào
giếng, phối hợp với nhà máy cung cấp nước miễn phí cho người dân. 1 tỉ còn
lại, cô sẽ hỗ trợ công tác phòng chống Covid-19 và điều trị người nhiễm nCoV.
Phía Hồ Ngọc Hà dự kiến gửi số tiền này đến Bộ Y tế để cơ quan chức năng có
phương án sử dụng phù hợp.

Hôm 13-3, ca sĩ Phi Nhung cũng cùng hai con nuôi Bến Tre, Tiền Giang tặng 500
lít nước ngọt và 50 bồn chứa nước với tổng trị giá 100 triệu đồng cho người
dân thuộc xã Hưng Nhượng (Giồng Trôm, Bến Tre). Tiếp đó, Phi Nhung đóng góp
thêm 100 triệu đồng cho chùa Lương Viên (xã Lương Hòa Lạc, Chợ Gạo, Tiền
Giang) để khoan giếng tầng sâu, giúp người dân có nước ngọt.

. Tối 13-3, hai ca sĩ Tùng Dương và Phạm Thùy Dung công bố ủng hộ 2.000 bộ
quần áo bảo hộ chống dịch tới bộ đội biên phòng, nơi ngày đêm túc trực cùng
các trung tâm y tế và công an phường tại Hà Nội.  

Tùng Dương và Phạm Thùy Dung cũng hy vọng hoạt động ủng hộ này sẽ được nhân
rộng để ""các văn phòng lại sớm trở lại hoạt động bình thường, trẻ em được đến
trường học chữ học hát, công viên lại đầy các hoạt động thể thao của người
già... Vì một sức khỏe của người Việt Nam"".

![Hồ Ngọc Hà, Chi Pu quyên góp 4 tỉ chống Covid-19 và hạn mặn - Ảnh
3.](https://nld.mediacdn.vn/thumb_w/684/2020/3/14/anh-chup-man-
hinh-2020-03-14-luc-154717-1584175799234684721369.png)

Tùng Dương và Phạm Thùy Dung công bố ủng hộ 2.000 bộ quần áo bảo hộ chống dịch

Phạm Thùy Dung chia sẻ, số tiền đóng góp sẽ được dùng để mua nước khử trùng,
quần áo bảo hộ, khẩu trang, găng tay và vitamin C cho các đơn vị nói trên.

![Hồ Ngọc Hà, Chi Pu quyên góp 4 tỉ chống Covid-19 và hạn mặn - Ảnh
4.](https://nld.mediacdn.vn/thumb_w/684/2020/3/14/anh-chup-man-
hinh-2020-03-14-luc-154012-15841756564152037286512.png)

Ca sĩ Tóc Tiên hưởng ứng lời kêu gọi của đàn anh và ủng hộ 100 triệu đồng

Ngay sau lời kêu gọi này, sáng 14-3, Tùng Dương vui mừng thông báo anh đã nhận
được nhiều đóng góp từ các đồng nghiệp, bạn bè. Trong đó, ca sĩ [**Tóc
Tiên**](https://nld.com.vn/toc-tien.html ""Tóc Tiên"") góp 100 triệu đồng với
lời nhắn: ""Mỗi người một ít. Trong Nam em cũng ủng hộ bà con miền Tây, ngoài
Bắc thì nhờ anh vậy"".

Đến trưa ngày 14-3, sau nửa ngày phát động, số tiền ủng hộ ca sĩ Tùng Dương
nhận được là gần 165 triệu đồng, cùng 2.900 bộ quần áo chống dịch, 1.500 khẩu
trang vải và 1.300 chai nước rửa tay và diệt khuẩn. Trong đó, ca sĩ Hoàng Thuỳ
Linh đóng góp 500 bộ quần áo bảo hộ chống dịch.

![Hồ Ngọc Hà, Chi Pu quyên góp 4 tỉ chống Covid-19 và hạn mặn - Ảnh
5.](https://nld.mediacdn.vn/thumb_w/684/2020/3/14/hoang-thuy-
linh-15841758319331297793193.jpg)

Ca sĩ Hoàng Thuỳ Linh ủng hộ 500 bộ quần áo bảo hộ

Tùng Dương cho biết anh rất cảm động vì đóng góp của bạn bè trong chiến dịch
phòng chống Covid-19.

Nam ca sĩ Hà Anh Tuấn cùng hai người bạn là đạo diễn Cao Trung Hiếu, nhà sản
xuất Minh Hoàng đã chi gần 2 tỉ đồng để tài trợ tặng thiết bị máy móc cùng phụ
kiện tổng thể để thiết lập 3 phòng điều trị cách ly áp lực âm nhập khẩu trọn
gói từ Đức cho bệnh nhân nghi nhiễm và nhiễm virus Covid-19 cũng như các
trường hợp bệnh nhân cần cách ly khác tại Hà Nội, TP HCM và tỉnh Quảng Ninh.  

Thùy Trang - Yến Anh; ảnh NVCC

[

Chia sẻ

](javascript:;)

[ ![](https://nld.mediacdn.vn/web_images/icon-print-3.png)
](/Print.aspx?NewsID=202003140758139 ""Print"")

"
20/03/2020,Nhật Bản và nỗi lo Olympic Tokyo 2020,https://nld.com.vn/the-thao/nhat-ban-va-noi-lo-olympic-tokyo-2020-20200319222422222.htm,"##  Là quốc gia tiên phong đóng cửa trường học đến tận tháng 4 và sớm ban hành
tình trạng khẩn cấp quốc gia vì đại dịch Covid-19 nhưng Nhật Bản lại rất kiên
định trong việc tổ chức Olympic Tokyo đúng kế hoạch

","Đông Linh

",,https://nld.mediacdn.vn/thumb_w/684/2020/3/19/14-anh-bai-chot-tr-14--15846286004821932051429.jpg|Nhật Bản và nỗi lo Olympic Tokyo 2020 - Ảnh 1.,"Cùng ngày 17-3, với sự kiện LĐBĐ châu Âu quyết định dời lại 1 năm thời hạn tổ
chức vòng chung kết EURO 2020, Ủy ban Olympic quốc tế (IOC) vẫn ra thông điệp
đề nghị lực lượng VĐV trên toàn thế giới sẵn sàng tham gia [Olympic
Tokyo](https://nld.com.vn/olympic-tokyo.html ""Olympic Tokyo"") trong trạng thái
tốt nhất. Chia sẻ quan điểm với các giới chức IOC, Thủ tướng Nhật Bản Abe
Shinzo khẳng định quốc gia này sẽ làm tất cả để Olympic Tokyo khai mạc đúng
vào ngày 24-7.  

Vì sao trước sự phản đối quyết liệt của giới thể thao trong tình hình dịch
bệnh Covid-19 diễn biến phức tạp trên toàn thế giới, người Nhật vẫn quyết tâm
tổ chức bằng được kỳ Thế vận hội mùa hè thứ nhì trong lịch sử trên sân nhà?

Câu chuyện về vụ động đất ở TP Kobe năm 1995 cho đến nay vẫn được nhắc đến như
là nét văn hóa ứng xử chủ đạo trong đời sống của người Nhật. Hai ngày sau trận
động đất khủng khiếp tại TP miền Nam Nhật Bản khiến hơn 6.000 người thiệt
mạng, cơ sở hạ tầng bị phá hủy nghiêm trọng, 80% tuyến đường sắt được phục hồi
và tiếp tục hoạt động. Chỉ có điều quy mô này không phù hợp với tiêu chuẩn của
ngành giao thông Nhật Bản. Xấu hổ vì công việc không hoàn thành, một quan chức
của Công ty Đường sắt Kansai đã tự kết liễu đời mình.

![Nhật Bản và nỗi lo Olympic Tokyo 2020 - Ảnh
1.](https://nld.mediacdn.vn/thumb_w/684/2020/3/19/14-anh-bai-chot-tr-14--
15846286004821932051429.jpg)

Đồng hồ đếm ngược ngày khai mạc Thế vận hội 2020 đặt tại Tokyo hôm 16-3 Ảnh:
REUTERS

Văn hóa xấu hổ - ""haji"" trong tiếng Nhật Bản - gắn liền với những điều không
ổn đã là một phần của cuộc sống ở đất nước này. Sẽ không phải là lỗi của Nhật
Bản nếu Thế vận hội Tokyo không thể diễn ra do hậu quả của đại dịch Covid-19.
Thế nhưng, nếu phải hủy bỏ sự kiện mà suốt 7 năm qua người Nhật đã dốc toàn
lực chuẩn bị, sẽ là quyết định vô cùng khó khăn cho chính phủ nước này.

Tổ chức thành công Thế vận hội là nền tảng cho thông điệp ""Nhật Bản trở lại""
mà Thủ tướng Abe Shinzo muốn qua đó thúc đẩy tinh thần yêu nước của mọi người
dân, đồng thời thể hiện sự đổi mới cũng như thái độ cởi mở của Nhật Bản. Ngân
sách ban đầu dành cho sự kiện thể thao hàng đầu hành tinh này là 11 tỉ bảng đã
sớm tăng lên đến 20,3 tỉ bảng.

Chỉ riêng việc vận động được khoản tài trợ trị giá lên đến 2,6 tỉ bảng, chủ
yếu từ hơn 60 công ty Nhật Bản, cũng đã đủ để biến kỳ đại hội này trở thành sự
kiện được tài trợ nhiều nhất trong lịch sử thể thao. Một tập đoàn hàng đầu chi
khoảng 92,5 triệu bảng để trở thành một trong 15 nhà tài trợ ""vàng"" nhưng
quyền lợi đổi lại ""hầu như chẳng có gì"", như giám đốc điều hành tập đoàn này
thừa nhận dù số tiền tương đương một khoản lớn ngân sách tiếp thị của doanh
nghiệp trong nhiều năm.

Hủy bỏ Olympic sẽ gây ra lãng phí khủng khiếp về mọi phương diện và đó là lý
do chính phủ của ông Abe Shinzo kiên định với mục tiêu tổ chức như kế hoạch,
tất nhiên bên cạnh đó là công tác phòng dịch Covid-19 được đẩy mạnh.

“IOC đã đàm phán với 220 VĐV về cuộc khủng hoảng đại dịch Covid-19. Vẫn còn
hơn 4 tháng nữa trước Tokyo 2020 và chúng tôi sẽ tiếp tục hành động một cách
có trách nhiệm. Hai nguyên tắc của chúng tôi: Bảo vệ an toàn, sức khỏe của VĐV
và bảo vệ sự toàn vẹn của thể thao Olympic” - Chủ tịch IOC Thomas Bach cho
biết.

Đông Linh

[

Chia sẻ

](javascript:;)

[ ![](https://nld.mediacdn.vn/web_images/icon-print-3.png)
](/Print.aspx?NewsID=20200319222422222 ""Print"")

"
24/03/2020,Olympic Tokyo 2020 sẽ hoãn lại vì dịch Covid-19,https://nld.com.vn/the-thao/olympic-tokyo-2020-se-hoan-lai-vi-dich-covid-19-20200324095849842.htm,"##  (NLĐO) - Ông Dick Pound, một thành viên Ủy ban Olympic quốc tế (IOC) tiết
lộ chuyện Olympic Tokyo 2020 sẽ hoãn sang năm 2021 vì sự bùng phát của đại
dịch Covid-19 trên toàn thế giới.

","Tường Phước - Ảnh: Fox Sports

",,https://nld.mediacdn.vn/thumb_w/684/2020/3/24/grqg-1585018565446715357333.jpg|Olympic Tokyo 2020 sẽ hoãn lại vì dịch Covid-19 - Ảnh 1.,"Hôm 22-3, IOC xem xét việc hoãn Thế vận hội và sẽ đưa ra quyết định trong vòng
một tháng tới nhưng sẽ không có kịch bản hủy sự kiện. [Olympic Tokyo
2020](https://nld.com.vn/olympic-tokyo-2020.html ""Olympic Tokyo 2020"") dự kiến
sẽ diễn ra vào cuối tháng 7 năm nay nhưng theo tiết lộ của thành viên kỳ cựu
Ủy ban IOC, sự kiện chắc chắn sẽ không diễn ra như dự kiến.  

![Olympic Tokyo 2020 sẽ hoãn lại vì dịch Covid-19 - Ảnh
1.](https://nld.mediacdn.vn/thumb_w/684/2020/3/24/grqg-1585018565446715357333.jpg)

Ông Dick Pound, thành viên IOC dự đoán Olympic Tokyo 2020 sẽ phải hoãn lại tới
năm 2021. ""Trên cơ sở thông tin mà IOC có được, việc hoãn lại đã được quyết
định. Các tính toán về kế hoạch thay thế chưa được xác định, nhưng Thế vận hội
mùa Hè sẽ không bắt đầu vào ngày 24-7, tôi biết chắc điều đó"", ông Pound phát
biểu trên tờ _USA Today_.  

Covid-19 đang hoành hành mạnh ở rất nhiều quốc gia trên thế giới, trong đó có
Nhật Bản, quốc gia tổ chức Olympic 2020. Chính vì điều này, Ủy ban Olympic của
Canada là bên đầu tiên tuyên bố sẽ không cử các VĐV đến Thế vận hội trong tuần
này và Ủy ban Olympic Úc nói với các VĐV hãy chuẩn bị cho khả năng sự kiện này
sẽ được tổ chức vào năm tới. Quyết địch của Canada và Úc nhận được sự đồng
tình của nhiều quốc gia. Chủ tịch Hiệp hội Olympic Anh, Hugh Robertson, cho
biết ông hi vọng nước Anh sẽ sớm có quyết định “sát cánh” cùng hai quốc gia
này.

Covid-19 đã giết chết hơn 16.000 người trên toàn thế giới và đã có hơn 370.000
trường hợp nhiễm virus được xác nhận nên dù IOC khẳng định rằng các “địa điểm
có nguy cơ lây nhiễm” có thể sẽ không được sử dụng để tập luyện hay thi đấu
nhưng chắc chắn việc tập trung tổ chức hơn 33 môn thể thao Olympic vào lúc này
là điều không nên làm.

Tường Phước - Ảnh: Fox Sports

[

Chia sẻ

](javascript:;)

[ ![](https://nld.mediacdn.vn/web_images/icon-print-3.png)
](/Print.aspx?NewsID=20200324095849842 ""Print"")

"
